{
  "frameId": "frame-001",
  "timeNs": 0,
  "operation": "PRISTINE",
  "phase": "PREPARE",
  "selectedCell": { "row": 0, "col": 0 },
  "nodes": {
    "wl": [0, 0, 0, 0],
    "bl": [0, 0, 0, 0],
    "sl": [0, 0, 0, 0]
  },
  "cell": {
    "transistor": {
      "vg": 0,
      "vs": 0,
      "vd": 0,
      "on": false
    },
    "rram": {
      "v": 0,
      "i": 0,
      "r": 1000000,
      "state": "PRISTINE",
      "formingDone": false
    }
  },
  "model": {
    "fidelity": "F0",
    "profileId": "bipolar_teaching_v1",
    "profileVersion": "1.0.0",
    "seed": 42
  },
  "checks": []
}
